<?xml version="1.0" encoding="UTF-8" ?>
<!-- vim: tw=0
-->
<!DOCTYPE xaraya_module SYSTEM "./modwizard.dtd">

<xaraya_module>

    <!-- ABOUT

        Information about you and your module

    -->
    <about>

        <name>ModWizard Example - Minimal </name>
        <copyright>by Michael Jansen</copyright>
        <license>GPL (http://www.gnu.org/licenses/gpl.html)</license>

        <author>
            <name>Michael Jansen</name>
            <email>module-wizard@michael-jansen.biz</email>
        </author>


        <description>

            <!-- add a short ONE LINE description -->
            <short>Module Wizard Test Module I</short>
            <!-- add a description as long and detailed as you want. -->
            <long>
            * The minimal module to generate
            *   # no tables
            *   # no hooks
            *   # no blocks
            *   </long>
        </description>

    </about>

    <!-- MODULE REGISTRY

        insert the appropriate values you got from the module registry at
        http://www.xaraya.org

    -->
    <registry>

        <id>5648880</id>
        <name>modwizard_minimal</name>

    </registry>

    <!-- MODULE CONFIGURATION related stuff -->
    <configuration>

        <!-- CAPABILITIES OF THE MODULE

        -->
        <capabilities>

            <!-- Add code for short url-support? -->
            <supportshorturls>yes</supportshorturls>

            <!-- Add code to change <head> -> <title> tag for each page? -->
            <setpagetitle>yes</setpagetitle>

            <item_hooks>no</item_hooks>
            <module_hooks>no</user_menu_hook>
            <search_hook>no</search_hook>
            <transform_hooks>no</transform_hooks>
            <user_menu_hook>no</user_menu_hook>
            <waiting_content_hook>no</waiting_content_hook>

        </capabilities>


        <!-- MODULE VARIABLES

            * create and initialize / remove in xarinit
            * create a default admin_configuration possibility ??

        -->
        <modvars>
            <!--
            <var type="number" name="MembersPerPage">0</var>
            -->
        </modvars>

        <!-- HOOKS

            You have different options here:

                The enable attribute controls the generation of the hook
                calls. These calls are only generated if you say enable="yes" !

                Inside you can list module which should be hooked during
                module initialization.

        -->
        <hooks />

        <!-- SECURITY related stuff ( ROLES / PRIVILEGES )

            Create / remove Instances and Masks during initialization / removing

                The appropriate calls have to be inserted manually

            MODULE Level Instance and Masks for Blocks and Itemtypes will be created automatically and used to
            provide basic access control.
        -->
        <security />

    </configuration>

    <!-- DATABASE related stuff -->
    <database />

    <!-- BLOCKS

        stub functions and privileges will be generated
    -->
    <blocks />

</xaraya_module>
